{
  "$schema": "https://json-schema.org/draft/2020-12/schema",
  "$id": "https://github.com/KeyanHu-git/SlideGuard/schemas/export-request-1.0.json",
  "title": "SlideGuard ExportRequest 1.0",
  "type": "object",
  "additionalProperties": false,
  "required": ["schemaVersion", "input"],
  "properties": {
    "schemaVersion": {"const": "1.0"},
    "taskId": {"type": "string", "minLength": 1, "maxLength": 200},
    "idempotencyKey": {
      "type": "string",
      "minLength": 1,
      "maxLength": 200,
      "pattern": "^[A-Za-z0-9][A-Za-z0-9._:-]*$"
    },
    "input": {"type": "string", "minLength": 1},
    "slides": {"type": "string", "minLength": 1, "maxLength": 4096, "default": "1"},
    "outputRoot": {"type": "string", "minLength": 1},
    "crop": {
      "type": "object",
      "additionalProperties": false,
      "properties": {
        "mode": {"enum": ["auto", "manual"], "default": "auto"},
        "boundsPercent": {"$ref": "#/$defs/bounds"},
        "expandPercent": {
          "oneOf": [
            {"type": "number", "minimum": 0, "maximum": 100},
            {"$ref": "#/$defs/edges"}
          ],
          "default": 0
        },
        "paddingPx": {"type": "integer", "minimum": 0, "maximum": 100000, "default": 16}
      },
      "default": {"mode": "auto", "expandPercent": 0, "paddingPx": 16},
      "allOf": [
        {
          "if": {"properties": {"mode": {"const": "manual"}}, "required": ["mode"]},
          "then": {"required": ["boundsPercent"]},
          "else": {"not": {"required": ["boundsPercent"]}}
        }
      ]
    },
    "quality": {
      "type": "object",
      "additionalProperties": false,
      "properties": {
        "referenceWidth": {"type": "integer", "minimum": 320, "maximum": 20000, "default": 4000},
        "pdfMaxBytes": {"type": ["integer", "null"], "minimum": 1, "default": null},
        "pdfMaxImageDimension": {"type": ["integer", "null"], "minimum": 1, "default": null},
        "pdfJpegQuality": {"type": "integer", "minimum": 1, "maximum": 100, "default": 95},
        "svgMaxBytes": {"type": ["integer", "null"], "minimum": 1, "default": null},
        "dpis": {"$ref": "#/$defs/positiveIntegers", "default": [72, 96, 120, 144, 192, 300, 600]},
        "svgWidths": {"$ref": "#/$defs/positiveIntegers", "default": [640, 1600, 3840]}
      },
      "default": {}
    },
    "behavior": {
      "type": "object",
      "additionalProperties": false,
      "properties": {
        "strict": {"type": "boolean", "default": true},
        "dryRun": {"type": "boolean", "default": false},
        "progress": {"enum": ["none", "jsonl"], "default": "none"}
      },
      "default": {}
    }
  },
  "$defs": {
    "bounds": {
      "type": "object",
      "additionalProperties": false,
      "required": ["left", "top", "right", "bottom"],
      "properties": {
        "left": {"type": "number", "minimum": 0, "maximum": 100},
        "top": {"type": "number", "minimum": 0, "maximum": 100},
        "right": {"type": "number", "minimum": 0, "maximum": 100},
        "bottom": {"type": "number", "minimum": 0, "maximum": 100}
      }
    },
    "edges": {
      "type": "object",
      "additionalProperties": false,
      "required": ["left", "top", "right", "bottom"],
      "properties": {
        "left": {"type": "number", "minimum": 0, "maximum": 100},
        "top": {"type": "number", "minimum": 0, "maximum": 100},
        "right": {"type": "number", "minimum": 0, "maximum": 100},
        "bottom": {"type": "number", "minimum": 0, "maximum": 100}
      }
    },
    "positiveIntegers": {
      "type": "array",
      "minItems": 1,
      "maxItems": 64,
      "uniqueItems": true,
      "items": {"type": "integer", "minimum": 1}
    }
  }
}
